product_id,comment,comment_clean,rating,positive,negative
honor-x8b,máy sao cũng được ghét nhất cái zalo vui nó báo hiện tên cuộc gọi,máy ghét zalo vui báo hiện cuộc_gọi,3,0,1
honor-x8b,chiếc điện thoại mỏng nhất tôi từng dùng cũng là chip trên máy này mượt hơn,điện_thoại mỏng chip máy mượt,5,1,0
honor-x8b,sao hôm tôi mua lại không được tặng tai nghe như trong giới thiệu nhỉ hôm đấy,hôm mua không tặng tai giới_thiệu hôm đấy,4,0,0
honor-x8b,em mua được tuần trả lại mất bao nhiêu ạ,mua tuần trả bao nhiêu,3,0,0
honor-x8b,thế giới di động có cường lực của honor không ạ,thế_giới di_động cường_lực honor không,4,0,0
