product_id,comment,rating,source_file,label
oppo-a60-128gb,rất tốt máy chỉ sử dụng nghe gọi nhắn tin mà không chơi game thì quá tốt camera nét loa cũng ok nói chung là tốt,5,ratings\oppo-a60-128gb.csv,positive
oppo-a60-128gb,sạc lâu pin nhanh hết,2,ratings\oppo-a60-128gb.csv,negative
oppo-a60-128gb,máy dùng hay so với giá tiền,5,ratings\oppo-a60-128gb.csv,positive
oppo-a60-128gb,máy dùng hay so với giá tiền,5,ratings\oppo-a60-128gb.csv,positive
oppo-a60-128gb,khá thất vọng vì pin quá nhanh hết mình cần là pin trâu chứ ngày sạc liên tục thế này không ổn mặc dù mua chưa được một tuần pin thua cả con oppo a58 của mình lên bảo hành thì bảo máy bình thường lúc nhận máy thì hộp không còn nguyên vẹn kèm khá nhiều dấu vân tay,1,ratings\oppo-a60-128gb.csv,negative
oppo-a60-128gb,cảm giác máy khá mượt camera đẹp sạc nhanh nói chung ok,5,ratings\oppo-a60-128gb.csv,positive
oppo-a60-128gb,tôi thích thiết kế của máy photo này,5,ratings\oppo-a60-128gb.csv,positive
oppo-a60-128gb,rất đáng trải nghiệm mượt và đẹp,5,ratings\oppo-a60-128gb.csv,positive
oppo-a60-128gb,mua cho ba mình xài rất ưng cảm ơn tgđ,5,ratings\oppo-a60-128gb.csv,positive
oppo-a60-128gb,máy đẹp và có kháng nước rất tốt tôi rất thích,5,ratings\oppo-a60-128gb.csv,positive
oppo-a60-128gb,sao điện thoại tôi mới mua tầm khoảng một tuần mà thấy sao hết pin nhanh quá,1,ratings\oppo-a60-128gb.csv,negative
oppo-a60-128gb,mới mua hôm qua 55tr nay giảm còn 5tr mà màn hình chán vãi không ưng,1,ratings\oppo-a60-128gb.csv,negative
oppo-a60-128gb,mới mua được tuần thì thế giới di động giảm giá mất tới 500k nhìn chỉ muốn vứt mẹ đi máy lác bắt wifi kém đổi sang con khác thì mất hơn củ nữa dân lo xót lắm,2,ratings\oppo-a60-128gb.csv,negative
oppo-a60-128gb,xai rất rất tốt nha cả nhà mình nhé,5,ratings\oppo-a60-128gb.csv,positive
oppo-a60-128gb,đã dùng hơn tháng pin trâu không chơi game nên máy mượt tuyệt vời cho dòng trung cấp,5,ratings\oppo-a60-128gb.csv,positive
oppo-a60-128gb,ấn nút nguồn để khoá máy khi đó màn hình tắt nhưng ấn thêm lần nữa thì máy vẫn ở trạng thái mở khoá máy không yêu cầu nhập khẩu để mở khoá cho bảo mật,2,ratings\oppo-a60-128gb.csv,negative
oppo-a60-128gb,điện thoại quá tệ loạn cảm ứng nhĩu màn hình nó cứ đứng máy quài chán ghê,1,ratings\oppo-a60-128gb.csv,negative
oppo-a60-128gb,rất là tệ không chơi game chỉ fb với zalo mới dùng được 3 tháng đã bị đơ load chậm quá chán,2,ratings\oppo-a60-128gb.csv,negative
oppo-a60-128gb,sản phẩm dùng tốt giá giao máy nhiệt tình 10đ,5,ratings\oppo-a60-128gb.csv,positive
oppo-a60-128gb,qua tuần sử dụng máy mượt pin trâu,5,ratings\oppo-a60-128gb.csv,positive
oppo-reno12-5g-12gb-512gb,sao dùng máy mà messenger cứ báo đang đợi mạng suốt,2,ratings\oppo-reno12-5g-12gb-512gb.csv,negative
oppo-reno12-5g-12gb-512gb,mong các bạn hỗ trợ mình mình không tìm thấy ứng dụng al studio trên điện thoại oppo reno 5g,5,ratings\oppo-reno12-5g-12gb-512gb.csv,positive
oppo-reno12-5g-12gb-512gb,em cần thay mặt kính thay ở đâu ạ,5,ratings\oppo-reno12-5g-12gb-512gb.csv,positive
oppo-reno12-5g-12gb-512gb,pin tuột hơn tuột váy người yêu cũ nữa sạc pin thì nóng máy dảm con ngang luôn như mới mua được bữa giờ bán lại thì lỗ mất nhiêu tiền chứ máy này không ưng ý gì cả,2,ratings\oppo-reno12-5g-12gb-512gb.csv,negative
oppo-reno12-5g-12gb-512gb,mua điện thoại có ốt không xài được cũng như ko chủ yếu có ốt để thu âm live mà không được dở ẹt có để tượng chưng cân nhắc trước khi mua,1,ratings\oppo-reno12-5g-12gb-512gb.csv,negative
oppo-reno12-5g-12gb-512gb,mua dế từ tháng tới nay xài vẫn mượt mà camera đẹp là thứ mình thích nhất ở sản phẩm này thanh thế giới di động,5,ratings\oppo-reno12-5g-12gb-512gb.csv,positive
oppo-reno12-5g-12gb-512gb,tôi đã dùng rất ưng ý rất tốt xứng đáng mua,5,ratings\oppo-reno12-5g-12gb-512gb.csv,positive
oppo-reno12-5g-12gb-512gb,tui mới mua có ngày gọi fb bị lỗi dòng oppo reno 125g bị lỗi sộc màn hình không khắc phục được tôi đã đổi máy mới nhưng vẫn không khắc phục được mọi người nếu mua nên cân nhắc nha đừng để như tui tôi lại đổi lên dòng máy khác thì bắt tôi phải chịu mất phí giá trị điện thoại trong khi tôi mới mua có vài bữa làm ăn như vậy sao tôi còn niêm tin để lại cho thế giới di động ủng hộ được nữa đây,1,ratings\oppo-reno12-5g-12gb-512gb.csv,negative
oppo-reno12-5g-12gb-512gb,camera chụp hình đẹp âm thanh rõ chơi game mượt nhưng miếng cường lực bị tróc rồi hiện tại thì thấy ok nhân viên dẫm ở ngã suối sâu trảng bàng nhiệt tình,5,ratings\oppo-reno12-5g-12gb-512gb.csv,positive
oppo-reno12-5g-12gb-512gb,reno 5g có phát được youtube dưới nền không ạ,5,ratings\oppo-reno12-5g-12gb-512gb.csv,positive
oppo-reno12-5g-12gb-512gb,điện thoại dùng rất tốt có nhiều tính năng hay nhất là camera ai chụp hình rất đẹp tích hợp cả remote điều khiển được nhiều thiết bị quá tuyệt vời pin dung lượng lớn sử dụng đươc thời gian dài,5,ratings\oppo-reno12-5g-12gb-512gb.csv,positive
oppo-reno12-5g-12gb-512gb,điện thoại sao khi trải nghiệm thấy mọi thứ rất ok loa nghe hay điện thoại kết nối với tai nghe và loa bluetooth rất nhanh chất âm nghe rất hay không uổng phí khi mua điện thoại này còn về camera thì khỏi chê nhân viên đàm thuận giao thuận an bình dương rất rất nhiệt tình và chu đáo được tặng phiếu mua hàng mua luôn những món rất cần thiết điện thoại chạy mượt ai thích điện thoại kiểu dáng gọn mỏng nhẹ nên mua điện thoại này,5,ratings\oppo-reno12-5g-12gb-512gb.csv,positive
oppo-reno12-5g-12gb-512gb,mới mua được gần tháng sau thời gian trải nghiệm thì con này rất ok mọi thứ điều ổn áp cầm chụp thì khỏi chê pin sạc nhanh sd cũng lâu mỏng nhẹ cầm nắm không đã tay do mình là nam nếu nữ sd thì khỏi phải bàn cãi like,5,ratings\oppo-reno12-5g-12gb-512gb.csv,positive
oppo-reno12-5g-12gb-512gb,rất là thích nha chất lượng chụp ảnh đẹp lượt game mượt đang định mua thêm cái nữa,5,ratings\oppo-reno12-5g-12gb-512gb.csv,positive
oppo-reno12-5g-12gb-512gb,nhu cầu không chơi game ít nghe nhạc ít xem phim chỉ sử dụng các tác vụ văn phòng nhẹ sản phẩm dùng tốt với nhu cầu,5,ratings\oppo-reno12-5g-12gb-512gb.csv,positive
oppo-reno12-5g-12gb-512gb,tốt,5,ratings\oppo-reno12-5g-12gb-512gb.csv,positive
oppo-reno12-5g-12gb-512gb,tốt,5,ratings\oppo-reno12-5g-12gb-512gb.csv,positive
oppo-reno12-f-5g-12gb-256gb,máy quá tệ mới mua dăm tháng mà không thể gọi video thua luôn các đoạn đứng hình là phổ biết tắt nguồn reset máy song vẫn vậy,1,ratings\oppo-reno12-f-5g-12gb-256gb.csv,negative
oppo-reno12-f-5g-12gb-256gb,còn hàng không bạn,5,ratings\oppo-reno12-f-5g-12gb-256gb.csv,positive
oppo-reno12-f-5g-12gb-256gb,máy mới mua về chưa đạt tiêu chuẩn là kính xịn mặt lưng kính gorilla vân vân trực tiếp là cảm ứng chính mà đã giảm giá lại còn thay thế sữa chữa hư hỏng kinh khủng tôi không được dùng đang phải đem trả gấp thật sự bị xúc phạm công nghệ,1,ratings\oppo-reno12-f-5g-12gb-256gb.csv,negative
oppo-reno12-f-5g-12gb-256gb,sài ke có điều dán cường lực nó không nhạy lắm lâu lâu cũng không ăn sạc pin nhanh cực kì,5,ratings\oppo-reno12-f-5g-12gb-256gb.csv,positive
oppo-reno12-f-5g-12gb-256gb,máy mới mua hôm pin tụt quá nhanh không sử dụng để qua đêm cũng tụt thực sự nản,2,ratings\oppo-reno12-f-5g-12gb-256gb.csv,negative
oppo-reno12-f-5g-12gb-256gb,nhanh hết pin không sài cũng tụt pin sài thì còn nhanh hơn điện thoại quá tệ mua được ngày,1,ratings\oppo-reno12-f-5g-12gb-256gb.csv,negative
oppo-reno12-f-5g-12gb-256gb,điện thoại mới mua hôm sao gọi điện zalo màn hình cứ đứng đơ máy nhanh nóng mong được phản hồi hỗ trợ,2,ratings\oppo-reno12-f-5g-12gb-256gb.csv,negative
oppo-reno12-f-5g-12gb-256gb,điện thoại mới mua trả góp được tuần em muốn đổi điện thoại khác có tốn phí gì không ạ điện thoại này xài mau nóng tuột pin quá,2,ratings\oppo-reno12-f-5g-12gb-256gb.csv,negative
oppo-reno12-f-5g-12gb-256gb,được tháng họ điện thoại nguyên quảng cáo không phản hồi lại,2,ratings\oppo-reno12-f-5g-12gb-256gb.csv,negative
oppo-reno12-f-5g-12gb-256gb,tệ camera mờ sạc lâu,1,ratings\oppo-reno12-f-5g-12gb-256gb.csv,negative
oppo-reno12-f-5g-12gb-256gb,máy mạnh camera đẹp mua từ lúc mới ra được tặng loa nghe rất hay cảm ơn thế giới di động,5,ratings\oppo-reno12-f-5g-12gb-256gb.csv,positive
oppo-reno12-f-5g-12gb-256gb,camera đẹp từ lúc mua về tôi thấy thích chụp hình hơn chụp cả buổi không thấy pin hao mấy xài tháng nay vẫn ổn mượt,5,ratings\oppo-reno12-f-5g-12gb-256gb.csv,positive
oppo-reno12-f-5g-12gb-256gb,tôi rất thích chụp hình nên đã chọn máy này phải nói là hợp ý lắm camera đẹp nét pin dùng cũng cả ngày,5,ratings\oppo-reno12-f-5g-12gb-256gb.csv,positive
oppo-reno12-f-5g-12gb-256gb,4đ cho con phone này thứ nhất là pin tuột nhanh dù không xài cũng tuột còn lướt fb hay tt xem thì xuống nhanh như tia chớp dù đã làm theo cách nhân viên hd nhưng vẫn không có tác dụng gì thứ cuộc gọi cước quá là nhỏ dù đã mở loa ngoài nhưng vẫn nhỏ thứ camera dùng app hay cam thường vẫn là kiểu không thay đổi quá nản,2,ratings\oppo-reno12-f-5g-12gb-256gb.csv,negative
oppo-reno12-f-5g-12gb-256gb,pin xuống nhanh máy dùng thì nóng,1,ratings\oppo-reno12-f-5g-12gb-256gb.csv,negative
oppo-reno12-f-5g-12gb-256gb,nhân viên phục vụ rất tận tình giới thiệu điện thoại rất ok nhưng khi mua về sử dụng mới thấy điện thoại rất dễ nóng điện thoại còn hay lỗi nữa zalo mess gọi đến không được trong khi sử dụng wifi và 4g camera thì chụp xấu mua về mới thấy hối hận,2,ratings\oppo-reno12-f-5g-12gb-256gb.csv,negative
oppo-reno12-f-5g-12gb-256gb,máy có bút nfc nhưng quét chip không đỏ như vậy là lỗi làm sao anh dùng đủ ngày đã chán rồi,2,ratings\oppo-reno12-f-5g-12gb-256gb.csv,negative
oppo-reno12-f-5g-12gb-256gb,chụp ảnh xấu nhanh xuống pin,2,ratings\oppo-reno12-f-5g-12gb-256gb.csv,negative
oppo-reno12-f-5g-12gb-256gb,chụp ảnh hình ảnh quá chán luôn thua sam sung hẳn điện thoại lịch dương thì có còn lịch âm thì quá thất vọng về phần hình ảnhko đáng để bỏ ra gần 10trieu để mua cái điện thoại này mới dùng có 6ngày là thấy chán từ mấy hôm trước rồi,2,ratings\oppo-reno12-f-5g-12gb-256gb.csv,negative
oppo-reno12-f-5g-12gb-256gb,rất hài lòng về cách của nhân viên phục vụ và máy đẹp xài rất là ok,5,ratings\oppo-reno12-f-5g-12gb-256gb.csv,positive
oppo-reno12-f-5g-12gb-256gb,ok trong tầm giá không chơi game nên thấy ok cấu hình thì không cao lắm bật hz nên mới nhanh,5,ratings\oppo-reno12-f-5g-12gb-256gb.csv,positive
oppo-reno12-f-5g-12gb-256gb,cắm mờ màn hiển thị không đẹp vân tay thì chậm truy xuất không nhanh nhạc thì tệ thua xa cả reno 7g 5g,1,ratings\oppo-reno12-f-5g-12gb-256gb.csv,negative
oppo-reno13-f-5g,camera chụp hình tệ quá đang muốn đổi gấp hic thất vọng,1,ratings\oppo-reno13-f-5g.csv,negative
oppo-reno13-f-5g,lúc mua thì ok lúc mình không thích bán lại thì chi nhánh không có tiền trong khi cả tập đoàn lớn,1,ratings\oppo-reno13-f-5g.csv,negative
oppo-reno13-f-5g,điện thoại sài ok mượt mà trải nghiệm được tháng thấy ok nên mua như mọi người,5,ratings\oppo-reno13-f-5g.csv,positive
oppo-reno13-f-5g,rất tệ mới đúng bắt wifi 5g mà len không nổi hối hận thật sự đối trả thì mất nhiều lúc đang gấp mà không lên mạng được là đập bỏ qua,2,ratings\oppo-reno13-f-5g.csv,negative
oppo-reno13-f-5g,sai lầm khi mua mình mua chả góp tháng muốn đổi sản phẩm khác,2,ratings\oppo-reno13-f-5g.csv,negative
oppo-reno13-f-5g,sản phẩm kém chất lượng nhân viên thái độ khi ra đổi trả sản phẩm lần cuối cùng mua hàng ở đây,2,ratings\oppo-reno13-f-5g.csv,negative
oppo-reno13-f-5g,màn hình độ sáng thấp hay bị nóng máy,2,ratings\oppo-reno13-f-5g.csv,negative
oppo-reno13-f-5g,tôi mua trả góp tại thế giới di động mới được tháng nay muốn đổi lại máy hãng khác không biết có được không rất mong sự phản hồi tích cực của nhà bán hàng cảm ơn,1,ratings\oppo-reno13-f-5g.csv,negative
oppo-reno13-f-5g,gọi điện message zalo cam trước sau rất kém tối thui thua xa con reno 2  5 năm trước cần tư vấn từ cửa hàng,2,ratings\oppo-reno13-f-5g.csv,negative
oppo-reno13-f-5g,cho sản phẩm cửa hàng 5 sao nhé,5,ratings\oppo-reno13-f-5g.csv,positive
realme-note-50-64gb,máy mua về bị chậm quá nhiều khi vào tiktok mà đợi hoài không vào được luôn mà bắt wifi kém,2,ratings\realme-note-50-64gb.csv,negative
realme-note-50-64gb,thông báo tất cả app điều trị mua về muốn đập,1,ratings\realme-note-50-64gb.csv,negative
realme-note-50-64gb,máy qua kem luc toi luc sang man hinh mua máy lan khong an thua,1,ratings\realme-note-50-64gb.csv,negative
realme-note-50-64gb,thông báo cuộc gọi zalo facebook không báo chạy đa nhiệm không nổi mua về muốn đập nát luôn,1,ratings\realme-note-50-64gb.csv,negative
realme-note-50-64gb,điện thoại lag quá không nên mua,1,ratings\realme-note-50-64gb.csv,negative
realme-note-50-64gb,ok rất tốt,5,ratings\realme-note-50-64gb.csv,positive
realme-note-50-64gb,mua lần và đổi lần về hưu tiếp điện thoại này mau hư lắm mọi người không nên mua nhé,1,ratings\realme-note-50-64gb.csv,negative
realme-note-50-64gb,em mới mua realme note mới bên thế giới di động được ngày hôm em muốn bán lấy tiền mặt là được bên á lúc mua 2 triệu phụ kiện hộp đầy đủ ạ,5,ratings\realme-note-50-64gb.csv,positive
realme-note-50-64gb,rất tốt,5,ratings\realme-note-50-64gb.csv,positive
realme-note-50-64gb,đã trả giựt lắc kinh khủng,1,ratings\realme-note-50-64gb.csv,negative
realme-note-50-64gb,máy sài mượt ok tốt trong tầm giá sẽ giới thiệu cho người thân khi mua máy phân khúc hơn triệu,5,ratings\realme-note-50-64gb.csv,positive
realme-note-50-64gb,mới mua mấy ngày hiện tượng giật lag rất nhiều không mượt thoát ra vào cũng bị đơ lag chuyển đổi ứng dụng cũng lag đơ liên tụcđốt chỉ xem tv mạng xã hội nghe gọi thôi không chơi game mà cũng giật lag nói chung sản phẩm quá tệ không nên mua,1,ratings\realme-note-50-64gb.csv,negative
realme-note-50-64gb,hơi lác,2,ratings\realme-note-50-64gb.csv,negative
realme-note-50-64gb,nói chung mọi thứ đều ổn áp,5,ratings\realme-note-50-64gb.csv,positive
realme-note-50-64gb,sử dụng rất tốt và pin được lâu,5,ratings\realme-note-50-64gb.csv,positive
realme-note-50-64gb,tốt,5,ratings\realme-note-50-64gb.csv,positive
realme-note-50-64gb,dùng tốt lướt fb xem phim ok ai mà muốn mua tặng người thân thì nên mua,5,ratings\realme-note-50-64gb.csv,positive
realme-note-50-64gb,tốt,5,ratings\realme-note-50-64gb.csv,positive
samsung-galaxy-a05s-6gb,máy mới mua về không tháo khe sim ra được,2,ratings\samsung-galaxy-a05s-6gb.csv,negative
samsung-galaxy-a05s-6gb,vẫn thích màn hình giọt nước,5,ratings\samsung-galaxy-a05s-6gb.csv,positive
samsung-galaxy-a05s-6gb,điện thoại đẹp màn hình lớn giá hợp lý mới mua nên thấy cũng ok về sau thì chưa biết pin trâu hiện tại thì tất cả đều ổn nên mua nên sử dụng mua thêm cái ốp lưng của hãng rất ok mua thêm cái kính cường lực của hãng luôn cũng rất tốt nhân viên đội tgdđ khóm thị trấn u minh tỉnh cà mau rất nhiệt tình và thân thiện,5,ratings\samsung-galaxy-a05s-6gb.csv,positive
samsung-galaxy-a05s-6gb,mình mới mua tối ngày giá là mà hôm nay thấy giá thật là không thể tin nổi,2,ratings\samsung-galaxy-a05s-6gb.csv,negative
samsung-galaxy-a05s-6gb,thiết kế đẹp dùng mượt mà,5,ratings\samsung-galaxy-a05s-6gb.csv,positive
samsung-galaxy-a05s-6gb,lần máy mới mua bị rè ra cửa hàng đổi lấy máy khác về xài được vài hôm máy lại rè,2,ratings\samsung-galaxy-a05s-6gb.csv,negative
samsung-galaxy-a05s-6gb,tôi thấy không nên xài con này quá tệ mua tháng mà đơ miết và tôi có cảm giác hàng bán ở việt mình là hàng dạt vậy á tôi từng mua dòng a02s ở philippines chất lượng còn tốt hơn con a05s này điều này khiến tôi suy nghĩ samsung tốt chất lượng hay chỉ là thương hiệu,1,ratings\samsung-galaxy-a05s-6gb.csv,negative
samsung-galaxy-a05s-6gb,ngày tôi có mua máy ở siêu thị tân nghĩa nhưng bạn bán máy cho tôi không tư vấn rõ về cốc sạt của máy là hai đầu chui nhỏ bạn chỉ bảo là sử dụng bộ sạt của ở nhà là sạt được tôi không hài lòng về cách tư vấn và thái độ của bạn,2,ratings\samsung-galaxy-a05s-6gb.csv,negative
samsung-galaxy-a05s-6gb,mới mua ngày pin xài tiếng tụt,1,ratings\samsung-galaxy-a05s-6gb.csv,negative
samsung-galaxy-a05s-6gb,cấu hình không giống trên web ghi chip snapdragon màn hình 90hz về check pc thì chỉ là snapdragon và màn hình chỉ có 60hz thêm nữa là loa âm thanh nhỏ,1,ratings\samsung-galaxy-a05s-6gb.csv,negative
samsung-galaxy-a05s-6gb,tốt,5,ratings\samsung-galaxy-a05s-6gb.csv,positive
samsung-galaxy-a05s-6gb,mua tháng đơ luôn cảm ứng nay đi hỏi thì kêu gửi bảo hành ngày rồi lấy gì xài trời mọi thứ đều ổn trời mua chú bảo vệ bắt bỏ dép ngoài mới được dô,2,ratings\samsung-galaxy-a05s-6gb.csv,negative
samsung-galaxy-a05s-6gb,hôm bữa mình cũng mua cây nhưng mic nói chuyện người khác không nghe không biết có cách nào khắc phục không nản,2,ratings\samsung-galaxy-a05s-6gb.csv,negative
samsung-galaxy-a05s-6gb,tôi mua với đúng giá nhưng chip nó không đúng với giới thiệu chỉ mà trên trang bán viết và ram của nó thì hay bị nhiều dung lượng cứ 1015p không dọn là lên 800mb đến 2g wifi thì lâu lâu mất mất rồi tự kết nối,1,ratings\samsung-galaxy-a05s-6gb.csv,negative
samsung-galaxy-a05s-6gb,cả ngày không dùng được nổi 2 tiếng mà tuột pin kinh khủng thất vọng quá,2,ratings\samsung-galaxy-a05s-6gb.csv,negative
samsung-galaxy-a05s-6gb,máy chạy mượt chơi game cũng rất mượt độ nhạy tốt nhận diện gương mặt camera không bị lỗi mà rất nhanh có thể chạy nền ứng dụng khá tốt,5,ratings\samsung-galaxy-a05s-6gb.csv,positive
samsung-galaxy-a05s-6gb,máy cơ bản tốt nghe gọi bình thường chạy mượt không chơi game nên không biết thế nào tóm lại khá hài lòng,5,ratings\samsung-galaxy-a05s-6gb.csv,positive
samsung-galaxy-a05s-6gb,san pham tot nhan vien phuc vu tan tinh,5,ratings\samsung-galaxy-a05s-6gb.csv,positive
samsung-galaxy-a05s-6gb,hiện tại khi tôi gọi zalo hay điện thoại đều nghe tiếng được tiếng mất nghe không rõ nghe rất nhỏ đem ra tgdv xem lại thì cứ bảo do mạng do app không đồng bộ từa lưa xong đem về được thời gian ngắn vẫn như cũ bực bội,2,ratings\samsung-galaxy-a05s-6gb.csv,negative
samsung-galaxy-a05s-6gb,sau tuần sử dụng thì máy quá nóng còn pin thì rất tốn không đến 5000mah không biết có thể đổi trả được không,2,ratings\samsung-galaxy-a05s-6gb.csv,negative
samsung-galaxy-a05s-6gb,đã sử dụng dịch vụ nhiều lần nhưng lần này trải nghiệm cực tệ nhân viên tư vấn hỏi thì ngơ ngơ không biết phục vụ nhân viên nữ tiễn khách thì vừa tiễn vừa nói chuyện với nhau không tôn trọng khách hàng,1,ratings\samsung-galaxy-a05s-6gb.csv,negative
samsung-galaxy-a05s-6gb,nhân viên bán hàng không có năng lực chuyên nghiệp có thái độ khó chịu với khách mua hàng ngay cả quản lý cũng trình độ hiểu biết yếu kém đi lê đức thọ gò vấp hễ nói nhân viên trừ tiền trong app quà tặng vip mà nhân viên còn muốn cự lại mình điện thoại thì lấy cái không còn seal đưa cho mình,1,ratings\samsung-galaxy-a05s-6gb.csv,negative
samsung-galaxy-a05s-6gb,ok,5,ratings\samsung-galaxy-a05s-6gb.csv,positive
samsung-galaxy-a05s-6gb,máy bật tắt đèn vẫn sáng chán,1,ratings\samsung-galaxy-a05s-6gb.csv,negative
samsung-galaxy-a05s-6gb,sao camera mờ,2,ratings\samsung-galaxy-a05s-6gb.csv,negative
samsung-galaxy-a05s-6gb,máy ngon trong tầm giá,5,ratings\samsung-galaxy-a05s-6gb.csv,positive
samsung-galaxy-a05s-6gb,tốt,5,ratings\samsung-galaxy-a05s-6gb.csv,positive
samsung-galaxy-a05s-6gb,sao chụp ảnh gần nó chỉ được đen trắng nhỉ,1,ratings\samsung-galaxy-a05s-6gb.csv,negative
samsung-galaxy-a05s-6gb,cách bản cập nhật phần mềm đã tải về máy như thế nào vậy,5,ratings\samsung-galaxy-a05s-6gb.csv,positive
samsung-galaxy-a05s-6gb,máy dùng ổn quay phim ok,5,ratings\samsung-galaxy-a05s-6gb.csv,positive
samsung-galaxy-a05s-6gb,mình mua máy cùng lúc máy ok lắm nguyên sai luôn nhé cả nhà phục vụ rất tuyệt vời ở đường nguyễn thái sơn phường quận gò vấp các bạn đánh giá sao mà thấy tệ vậy các bạn cò dìm hàng không vậy mình mua sản phẩm và sử dụng thấy rất tốt mọi người mua xong thì đánh giá đúng thực tế để người sau mua còn đọc tin nhắn để còn tiếp tục sử dụng sản phẩm chứ thanh các em ở shop điện máy xanh đã hỗ trợ rất nhiệt tình cho mình mình sẽ ủng hộ khi mua sản phẩm tiếp theo ở shop này,5,ratings\samsung-galaxy-a05s-6gb.csv,positive
samsung-galaxy-a05s-6gb,mình mua dùng về máy khá mượt nhanh thấy mọi người dùng phần mềm cpuz thì kiểm tra chip là sai không đúng sử dụng phần mềm cpuz là chip 680pin dùng khá trâu mình dùng thời gian liên tục cả ngày vẫn còn pin chụp hình nét hơn mấy hãng tàu hình sáng rất nét,5,ratings\samsung-galaxy-a05s-6gb.csv,positive
samsung-galaxy-a05s-6gb,quảng cáo là snapdragon mua máy về kiểm tra bằng cpu thì lại là snapdragon,1,ratings\samsung-galaxy-a05s-6gb.csv,negative
samsung-galaxy-a05s-6gb,rất tuyệt vời trong tầm giá này tôi hiểu mọi người chê sản phẩm này là do không biết sử dụng hay là làm rơi hỏng nhỉ tôi dùng ngày rồi thấy quá tuyệt vời,5,ratings\samsung-galaxy-a05s-6gb.csv,positive
samsung-galaxy-a05s-6gb,cảm thấy khá tốt pin ở mức ổn khá mượt mà ngoại hình đẹp và không thấy lỗi,5,ratings\samsung-galaxy-a05s-6gb.csv,positive
samsung-galaxy-a05s-6gb,bị hố khi mua hãng này rồi chạy chậm mới đổi lấy mà cái giờ còn tệ hơn pin mau tuột sai lầm phí tiền rồi,1,ratings\samsung-galaxy-a05s-6gb.csv,negative
samsung-galaxy-a05s-6gb,từ thất vọng,2,ratings\samsung-galaxy-a05s-6gb.csv,negative
samsung-galaxy-a25-8gb,máy dùng chưa được năm mà loạn cảm ứng,1,ratings\samsung-galaxy-a25-8gb.csv,negative
samsung-galaxy-a25-8gb,các bạn sử dụng cảm nhận thế nào nhưng mình sài vẫn thấy tốt nói về hàng thế giới di động là chuẩn nhất rơi và va chạm mạnh không bị gì cả chỉ móp nhẹ không bể hay là ảnh hưởng gì bên trong cả,5,ratings\samsung-galaxy-a25-8gb.csv,positive
samsung-galaxy-a25-8gb,mình sài gần tháng thấy máy không lỗi lầm gì mượt mà sao cảm thấy cảm ứng khi nhấn bàn phím nó nhảy nhảy sao á không biết là tại samsung nó vậy hay là bị sao nữa,5,ratings\samsung-galaxy-a25-8gb.csv,positive
samsung-galaxy-a25-8gb,mình không biết mọi người xài máy như thế nào chứ mình mua máy a25 và xài tới nay là tháng rồi mà vẫn rất là ok và mượt mà nói chung là mọi chức năng cũng như pin đều hoàn hảo sạc nhanh và cái a52 mình đang xài vẫn ok như vậy luôn,5,ratings\samsung-galaxy-a25-8gb.csv,positive
