product_id,comment,rating,source_file,label
samsung-galaxy-m15,lỗi chí mạng bệnh chung là bắt sóng điện thoại rất kém cuộc gọi nhiều lúc phải phút mới kết nối tới đầu dây bên kia làm giao hàng mà đi mua cái này tôi đã tự pin trâu thật nhưng trải nghiệm nghe gọi cơ bản rất tệ,1,ratings\samsung-galaxy-m15.csv,negative
samsung-galaxy-m15,mình mới mua được ngày cảm nhận máy là ok biên trâu xài ngày mới xạc lại các chức năng đều ok cả,5,ratings\samsung-galaxy-m15.csv,positive
samsung-galaxy-m15,máy mình mua ngày tại ngã tư lạc tấn tân trụ long an tới thời điểm hiện tại thì vân tay lúc nhạy lúc không máy có tình trạng trễlag nhẹ mặc dù thường xuyên dọn ram thường xuyên và không có đầy bộ nhớ rom tất cả tình trạng trên đều phải khởi động lại thì mới khắc phục được rất phiền khi sử dụng điện thoại này về phần camera chụp không đẹp ảnh mờ khó lấy nét nhân viên đm phục vụ nhiệt tình bạn tư vấn bên samsung tên quân thân thiện nhiệt tình,2,ratings\samsung-galaxy-m15.csv,negative
samsung-galaxy-m15,bắt sóng điện thoại và wifi cực kỳ kém còn thua cả con điện thoại cùi 3 triệu mấy tôi mua năm trước,1,ratings\samsung-galaxy-m15.csv,negative
samsung-galaxy-m15,máy mua được ngay xài tốt chạy xe còn ca ngay chưa hết pin chưa thấy vấn đề gì,5,ratings\samsung-galaxy-m15.csv,positive
samsung-galaxy-m15,máy sử dụng hay bị đơ samsung ngày càng tệ,2,ratings\samsung-galaxy-m15.csv,negative
samsung-galaxy-m15,rất tốt dùng ổn định,5,ratings\samsung-galaxy-m15.csv,positive
samsung-galaxy-m15,giật lag,2,ratings\samsung-galaxy-m15.csv,negative
samsung-galaxy-m15,mình mua con này hôm sử dụng tới nay mà thỉnh thoảng máy hay bị giật và đơ đứng bấm không chạy và phải khởi động máy lại mới bình thường máy dung lượng mà mình mới sử dụng có gb còn rất nhiều bộ nhớ mà như vậy máy tệ thật,2,ratings\samsung-galaxy-m15.csv,negative
samsung-galaxy-m15,rất ok pin trâu chơi game nhẹ cũng tốt,5,ratings\samsung-galaxy-m15.csv,positive
samsung-galaxy-m15,a em đã mua máy samsung m15 tình trạng hiện tại máy không tự giải phóng ram như những máy khác sau khoảng gần ngày sử dụng là dung lượng ram gần hết lúc đó máy không chạy được đơ phải khởi động lại máy chạy bình thường trường hợp này xử lý sao,2,ratings\samsung-galaxy-m15.csv,negative
samsung-galaxy-m15,máy zflip của tôi bị hư cáp không sạc pin bằng dây sạc chỗ bảo hành nói thay cả màn hình hết triệu không tin lắm vì họ không tháo máy ra kiểm tra mà chỉ nhìn bên ngoài tôi quyết định không thay màng hình và mua samsung m15 mục đích dùng cho đỡ thất vọng con flip và chờ mẫu phù hợp máy m15 rẻ tiền hơn tiền thay màng hình luôn phải công nhận là tôi rất hài lòng về samsung m15 này pin tốt lướt mượt quay phim chụp ảnh đẹp giá rẻ chỉ không thời trang bằng zflip thôi chứ chức năng không khác gì mà rẻ hơn nhiều hài lòng nhất có lẽ là khoảng pin vì tôi hay lướt web khuyến khích mọi người mua em này,5,ratings\samsung-galaxy-m15.csv,positive
samsung-galaxy-m15,máy xài ok rất mượt pin khá lâu,5,ratings\samsung-galaxy-m15.csv,positive
samsung-galaxy-m15,máy quá tệ mà giá quá chát đừng mua cục pin máy khá nặng hơn tháng dùng thấy tín hiệu mạng quá kém máy hay bị lạng cảm ứng không nhậy phím bấm đơ lác có khi bấm cả chục lần mới lên đúng chữ muốn bấm máy không có sạc chỉ kèm với chất lượng này chỉ đáng tầm trên củ,1,ratings\samsung-galaxy-m15.csv,negative
samsung-galaxy-m15,dạ em mua điện thoại được gần một tuần rồi giờ mua củ sạc có được giảm không ạ,5,ratings\samsung-galaxy-m15.csv,positive
samsung-galaxy-m15,dùng hơn tháng rồi pin trâu không chơi gem chơi tiến lên miền nam phep lâu lâu củng bi ao ra ssm15 thi chưa thấy chụp ảnh công viêc rất rỏ net comen thât củng có nó mặt tin tôi đi nên mua nhé,5,ratings\samsung-galaxy-m15.csv,positive
samsung-galaxy-m15,mình xài con m15 5g này chạy grab cũng gần hơn tháng rồi pin cấu hình cũng tạm được trong tầm giá của cấu hình tầm trung nói chung thì máy rất ổn không gặp vấn đề gì hết rất đáng tiền để mua,5,ratings\samsung-galaxy-m15.csv,positive
samsung-galaxy-m15,mới mua máy củ qua sử dụng nhân viên nhiệt tình máy tốt mượt cảm nhận về pin tuột khá nhanh như con 50003tr5 cho con này chơi game tầm trung khá tốt và mức 4tr không con adrion nào qua được nó đã từng sai rồi redmi và xiaomi cũng máy có cấu hình cao gấp bằng giá tiền và samsung cũng không có tuổi vs samsung và hệ điều hành adrion tuổi thọ tầm năm sẽ chậm lag thì với số tiền này múc m15 chơi game là được rồi không cần máy cấu hình cao năm sau cũng lại phải đổi máy sau tháng sài sẽ quay lại đánh giá tiếp cho em tham khảo,5,ratings\samsung-galaxy-m15.csv,positive
samsung-galaxy-m35-5g,mới mua xong xuống giá luôn nản,5,ratings\samsung-galaxy-m35-5g.csv,positive
samsung-galaxy-m35-5g,không tải được ảnh về zalo,2,ratings\samsung-galaxy-m35-5g.csv,negative
samsung-galaxy-m35-5g,khẳng định hàng chất lượng cảm biến nhạy sóng mạng loa hiển thị tốt pin cực game web ầm ầm ngày mới hết không rõ vì sao nhiều người chê này nọ chắc thuộc tuýp hơi kém công nghệ cài đặt búa xua chạy ngầm tổn thọ máy đối thủ vào chê bai bừa bãi gọi là chơi xấu haha,5,ratings\samsung-galaxy-m35-5g.csv,positive
samsung-galaxy-m35-5g,xài được thời gian rồi mà giờ tức quá lên đánh giá nè mình mua điện thoại này ở đắk song ngày tính mua a35 mà hết hàng nên mua con này mới mua về dùng được ngày cái bị lỗi không vô mail được phải chạy ra đổi cái mới rồi về xài thấy cũng thường đến tháng thứ và bây giờ thời điểm hiện tại nó hay bị lắc khi vào google gõ tìm đứng máy luôn bàn phím cũng đơ chụp hình thì xấu rất nhanh xuống pin ra ngoài sáng coi điện thoại bật sáng hết cỡ cũng thất tối thui thanh dấu vân tay không nhạy nó làm mình thấy phiền cục wifi kế bên mà nó lâu lâu không vô được mình có con nhỏ đi đổi trả thì bất tiện quá nên gáng xài lúc mua gần 85tr với giá này rất nhiều sự lựa chọn thấy thất vọng vô cùng nhà sản xuất nên xem xét coi lại dòng này hoặc nên thu hồi máy chưa gì hết tung ra thị trường rồi,1,ratings\samsung-galaxy-m35-5g.csv,negative
samsung-galaxy-m35-5g,tổng hợp những lỗi trên mà 35 sau hơn tháng sử dụng thứ nhất mở vân tay khuôn mặt quá kém thứ bắt wifi kém thứ bảo mật kém máy không tự đóng ứng dụng chạy ngầm được nên dẫn tới 4g rất tốn hơn dùng iphone thứ gọi video trên các ứng dụng zalo fb không hiện video kết nối mạng kém người khác gọi tới không kết nối được thứ camera cực tệ chụp xấu thứ máy màn hình tối khi ra ngoài trời dù nắng không to các máy hãng khác vẫn xem được nhưng máy samsung thì tăng hết độ sáng rồi vẫn không thấy gì thứ máy không dùng được tai nghe có dây lý do cổng sạc này trên thị trường rất ít hãng tương thích chỉ dùng được tai nghe không có dây kết nối thứ kết nối không dây với các thiết bị khác như loa không dây không được vì nó tìm không thấy thiết bị thứ sử dụng sim khi gọi không hiện sim hay sim gọi theo kiểu hên xui bỏ ra số tiền hơn triệu rước cục tức thề cạch mặt tất cả mọi sản phẩm samsung từ điện thoại tới tivi máy giặt,1,ratings\samsung-galaxy-m35-5g.csv,negative
samsung-galaxy-m35-5g,tôi mua máy samsung m35 về dùng thời gian thì wifi báo lỗi đã kết nối mà không sử dụng internet trong khi máy cũ vẫn kết nối bình thường tôi đã liên hệ cửa hàng thế giới di động và được đổi máy mới dùng hơn tuần thì máy lỗi lại như vậy thực sự rất mệt và phiền khi gặp sự cố này tôi nghĩ hãng nên thu hồi dòng máy này để test lại trước khi bán ra thị trường,1,ratings\samsung-galaxy-m35-5g.csv,negative
samsung-galaxy-m35-5g,thèm chửi thề nhau vài tuần bị đứng đem xuống đổi cái mới về vẫn đứng cạch samsung cách xử lí của nhân viên thế giới di động thì tệ cạch luôn thằng thế giới di động,1,ratings\samsung-galaxy-m35-5g.csv,negative
samsung-galaxy-m35-5g,ít khi đánh giá sản phẩm nếu phải nói trải nghiệm con máy này tệ mới mua từ hôm bắt sóng wifi kém thậm chí có lúc kết nối mà không có mạng phải khởi động lại máy sóng điện thoại thì lúc nào cũng được vạch có chỗ còn có vạch trong khi đó dùng dòng khác lúc nào cũng full các chức năng khác không đánh giá,2,ratings\samsung-galaxy-m35-5g.csv,negative
samsung-galaxy-m35-5g,máy tệ dùng dăm tháng loa ngoài rè cầm ra chợ thế giới di động bảo mình cầm ra samsung không chủ động bảo hành cầm ra samsung làm gì không biết mà lòi cái ron máy mà giờ loa nó rè hơn hình như móc cái màng ngoài vứt đi sao á bị lần cái đồng hồ và cái dế ở thế giới di động,1,ratings\samsung-galaxy-m35-5g.csv,negative
samsung-galaxy-m35-5g,máy sử dụng có con game mà cứ bị văng ra không vào được trong khi bộ nhớ không bị đầy máy thì xài duy nhất ứng dụng xoá tải lại chơi được ít hôm lại bị văng,2,ratings\samsung-galaxy-m35-5g.csv,negative
samsung-galaxy-m35-5g,pin dùng rất lâu máy mượt,5,ratings\samsung-galaxy-m35-5g.csv,positive
samsung-galaxy-m35-5g,pin 6k mà tuột nhanh hơn mấy máy pin 5k từ khi cập nhật phần mềm,2,ratings\samsung-galaxy-m35-5g.csv,negative
samsung-galaxy-m35-5g,dùng thấy ổn vì cục pin sài khá lâu mà cảm biến vân tay ở nút bên cạnh rìa thấy khá tiện,5,ratings\samsung-galaxy-m35-5g.csv,positive
samsung-galaxy-m35-5g,pin 6000mah mà tụt quá nhanh mới mua có được đổi cái khác không vậy,2,ratings\samsung-galaxy-m35-5g.csv,negative
samsung-galaxy-m35-5g,theo tui máy xoài ok do máy bạn ở dưới không biết sử dụng thôi,5,ratings\samsung-galaxy-m35-5g.csv,positive
samsung-galaxy-m35-5g,hôm nọ mua đúng dịp giảm giá nay lại thấy lên giá mới dùng được ngày thấy rất ok mọi thứ đều ổn cam chụp đêm rất mịn và tốt thiết kế đơn giản sang trọng cầm đầm tay sạc 25w mà cảm thấy cũng nhanh không khác 33w màn hình hiển thị tốt sáng đẹp,5,ratings\samsung-galaxy-m35-5g.csv,positive
samsung-galaxy-m35-5g,tôi mua m35 5g máy đã qua sử dụng của tgdđ với giá triệu có dán cường lực màn hình và mặt sau lưng bảo hành điện tử đến ngày qua tuần sử dụng thấy so với s8 active thì pin rất trâu máy mát chụp ảnh khá ok màn hình rất sáng dù chỉ mở sáng khoảng thôi cảm nhận chất lượng rất đáng với giá tiền sẽ giới thiệu bạn bè và người thân ủng hộ tgdđ,5,ratings\samsung-galaxy-m35-5g.csv,positive
samsung-galaxy-m35-5g,tốt,5,ratings\samsung-galaxy-m35-5g.csv,positive
samsung-galaxy-m35-5g,mình fan thế giới di động và mê quang linh lắm thấy quảng cáo là mua ngay,5,ratings\samsung-galaxy-m35-5g.csv,positive
samsung-galaxy-m35-5g,điện thoại xịn xài mát và pin trâu thực sự,5,ratings\samsung-galaxy-m35-5g.csv,positive
samsung-galaxy-m35-5g,xịn thật sự mình xài thấy hài lòng từ j7 lên đời samsung rất tuyệt vời fan hà nói with love,5,ratings\samsung-galaxy-m35-5g.csv,positive
samsung-galaxy-m35-5g,điện thoại rất mượt và mát pin trâu thật sự,5,ratings\samsung-galaxy-m35-5g.csv,positive
samsung-galaxy-m35-5g,mãi ủng hộ samsung và thế giới di động fan hà nói,5,ratings\samsung-galaxy-m35-5g.csv,positive
samsung-galaxy-m35-5g,tốt mát và mượt nha,5,ratings\samsung-galaxy-m35-5g.csv,positive
samsung-galaxy-m35-5g,xài được thời gian thì rất hài lòng samsung uy tín hơn các hãng trung quốc nên thấy an tâm khi mua tại tgdđ,5,ratings\samsung-galaxy-m35-5g.csv,positive
samsung-galaxy-s24-256gb-5g,điện thoại sóng quá kém s21 đã kém giờ đổi s24 còn tệ hơn điện thoại cầm trên tay mà người khác gọi tới thuê bao cột sóng chỉ lên được gạch,2,ratings\samsung-galaxy-s24-256gb-5g.csv,negative
samsung-galaxy-s24-256gb-5g,máy sóng yếu ai định mua thì nghĩ kĩ nha,1,ratings\samsung-galaxy-s24-256gb-5g.csv,negative
samsung-galaxy-s24-256gb-5g,máy tôi mới mua một tuần mà bỏ túi toàn người khác không gọi được để ra ngoài mới gọi được là sao,1,ratings\samsung-galaxy-s24-256gb-5g.csv,negative
samsung-galaxy-s24-256gb-5g,ai mà tại sao s24 không nhắn tin cho được mà s20 thì nhắn tin được là kiểm tra dung lượng gói 4g không lẽ s24 kém cỏi như vậy sao shop,1,ratings\samsung-galaxy-s24-256gb-5g.csv,negative
samsung-galaxy-s24-256gb-5g,phải thừa nhận con samsung này so với giá tiền thì khó chấp nhận được ram ổ thậm trí còn không bằng dòng a chip thì exynos tác vụ thường còn giật sóng thì kém đợi s25 chứ có lần sau thừa tiền cũng không mua dòng a mà chip exynos,2,ratings\samsung-galaxy-s24-256gb-5g.csv,negative
samsung-galaxy-s24-256gb-5g,bỏ ra gần 20tr mua cái điện thoại này mà tính năng cơ bản là nghe gọi không dùng được gọi đi thì được nhưng người ta gọi đến toàn báo thuê bao không liên lạc được dù đã đổi sim mới nhà làm ăn nghe gọi nhiều mà như này thì làm sao chấp nhận được cứ tưởng mỗi máy mình bị lên nhóm facebook nhiều người cũng kêu có người bảo hành lần cũng không hết lỗi có người đổi cái mới vẫn lỗi giờ vào đọc đánh giá ở tgdđ cũng nhiều người kêu lỗi đó thật sự rất khó chịu với cái điện thoại gần 20tr như này mong tgdđ có chính sách đáng thế nào hay thu hồi máy lỗi với những người mua dòng máy này,1,ratings\samsung-galaxy-s24-256gb-5g.csv,negative
samsung-galaxy-s24-256gb-5g,máy hay bị mất 4g thỉnh thoảng mất cả sóng điện thoại do máy không phải do sim nhé gọi đến không được gọi đi thì lại được pin không bền chưa bao giờ mua điện thoại gặp phải máy bị lỗi như thế nào,2,ratings\samsung-galaxy-s24-256gb-5g.csv,negative
samsung-galaxy-s24-256gb-5g,s24 sử dụng mạng 4g rất yếu hay bị đơ lỗi kết nối phải khởi động lại máy hoặc bật rồi tắt chế độ máy bay mới có mạng trở lại thất vọng quá,2,ratings\samsung-galaxy-s24-256gb-5g.csv,negative
samsung-galaxy-s24-256gb-5g,không bao giờ mua điện thoại sam sung cảm ứng nhạy khó chịu lắm,1,ratings\samsung-galaxy-s24-256gb-5g.csv,negative
samsung-galaxy-s24-256gb-5g,mình mua s24 được ngày mình phải ra samsung care tận lần vì lỗi không nhận được cuộc gọi lúc được lúc không dù đã được đổi máy mới lần nhưng tình trạng này vẫn tiếp tục mình cảm thấy thật sự thất vọng về s24 samsung và thế giới di động vì bỏ hơn chục củ mà rước cục nợ về người luôn lo sợ bị nhỡ các cuộc gọi quan trọng mong mọi người nghiên cứu kỹ trước khi mua sản phẩm này,1,ratings\samsung-galaxy-s24-256gb-5g.csv,negative
samsung-galaxy-s24-256gb-5g,thiết kế đẹp nhỏ gọn cầm nắm tốt galaxy ai hữu ích pin không đủ dùng một ngày,5,ratings\samsung-galaxy-s24-256gb-5g.csv,positive
samsung-galaxy-s24-256gb-5g,ngon hơn u23 đáng tiền,5,ratings\samsung-galaxy-s24-256gb-5g.csv,positive
samsung-galaxy-s24-256gb-5g,do cần máy làm việc nên có ra quầy thế giới di động ở đó mua gấp con s24 dù đã đọc đánh giá nhiều bạn nói nó bị mất sóng 4g và đúng thật con này bị lỗi 4g mình đã đổi máy theo chế độ bảo hành của thế giới di động máy đổi cũng tình trạng y hệt 4g như sau bão katrina vậy không hiểu sao dòng s cao cấp của samsung lại có lỗi như vậy mà vẫn bán ra tt mà bây giờ dùng không được đổi dòng khác tự dưng mất tiền dù lỗi của nhà sản xuất,2,ratings\samsung-galaxy-s24-256gb-5g.csv,negative
samsung-galaxy-s24-256gb-5g,pin tốt dùng cảm ứng mượt cầm vừa tay mà bắt sóng wifi chưa được tốt lắm với màn hình mà 2k nữa thì tốt ạ,5,ratings\samsung-galaxy-s24-256gb-5g.csv,positive
samsung-galaxy-s24-256gb-5g,lần đầu xài samsung mà thấy tuyệt vời quá rất xịn pin trâu và chụp đẹp fan hà nói,5,ratings\samsung-galaxy-s24-256gb-5g.csv,positive
samsung-galaxy-s24-256gb-5g,mình tin tưởng tgđ và giá này tốt nhất rồi điện thoại xịn đẹp,5,ratings\samsung-galaxy-s24-256gb-5g.csv,positive
samsung-galaxy-s24-256gb-5g,điện thoại giá rất tốt xài mượt và chụp đẹp fan ninh dương with love,5,ratings\samsung-galaxy-s24-256gb-5g.csv,positive
samsung-galaxy-s24-256gb-5g,máy bị lỗi 4g5g vào lúc được lúc không mình tưởng chỉ máy mình bị nên giới thiệu bạn mình mua thêm máy khác về cũng bị lỗi như nhau,1,ratings\samsung-galaxy-s24-256gb-5g.csv,negative
samsung-galaxy-s24-256gb-5g,pin 4k nhưng không hề yếu cam đẹp hiệu năng với mình như vậy là quá tốt do mình ít game kích thước vừa tay 5s nhé,5,ratings\samsung-galaxy-s24-256gb-5g.csv,positive
samsung-galaxy-s24-256gb-5g,thật sự để mà nói thì đã lâu lắm rồi mới dùng lại samsung công nhận tốt thật sự,5,ratings\samsung-galaxy-s24-256gb-5g.csv,positive
samsung-galaxy-s24-256gb-5g,máy mát không nóng pin được cả ngày nhỏ gọn cầm tay bữa cầm đi event zoom nét căng mê samsung từ lúc có ninh dương hà,5,ratings\samsung-galaxy-s24-256gb-5g.csv,positive
samsung-galaxy-s24-256gb-5g,zoom ban đêm nét căng gồng má ơi đẹp lắm,5,ratings\samsung-galaxy-s24-256gb-5g.csv,positive
samsung-galaxy-s24-256gb-5g,camera nét căng đu idol ok,5,ratings\samsung-galaxy-s24-256gb-5g.csv,positive
samsung-galaxy-s24-256gb-5g,hài lòng,5,ratings\samsung-galaxy-s24-256gb-5g.csv,positive
samsung-galaxy-s24-256gb-5g,dùng thực tế được thời gian thấy pin rất trâu và chụp đẹp thực sự chuyển từ iphone qua khi thấy ninh dương quảng cáo thấy chụp đẹp quá luôn dòng s samsung mãi đỉnh,5,ratings\samsung-galaxy-s24-256gb-5g.csv,positive
samsung-galaxy-s24-256gb-5g,xịn nhà trên cả hài lòng,5,ratings\samsung-galaxy-s24-256gb-5g.csv,positive
samsung-galaxy-s24-256gb-5g,mua được vài tháng thấy lựa chọn quá hợp lí và thế giới di động chăm sóc tốt fan ninh dương,5,ratings\samsung-galaxy-s24-256gb-5g.csv,positive
samsung-galaxy-s24-256gb-5g,sản phẩm rất hài lòng,5,ratings\samsung-galaxy-s24-256gb-5g.csv,positive
samsung-galaxy-s24-256gb-5g,s24 bị lỗi mạng 4g 5g không kết nối được hay bị ngắt kết nối chỉ sử dụng được wifi đến trung tâm bảo hành samsung tháng rồi vẫn không sửa được lỗi,1,ratings\samsung-galaxy-s24-256gb-5g.csv,negative
samsung-galaxy-s24-256gb-5g,camera rất xịn pin khá ổn mượt rất mượt,5,ratings\samsung-galaxy-s24-256gb-5g.csv,positive
samsung-galaxy-s24-256gb-5g,sản phẩm dùng tốt lắm best phone from thế giới di động,5,ratings\samsung-galaxy-s24-256gb-5g.csv,positive
samsung-galaxy-s24-256gb-5g,s24 này xịn nha biết sản phẩm từ khi ninh dương giới thiệu pin trâu thực sự chụp đêm rất đẹp trước mình xài iphone chụp buổi tối rất ghê,5,ratings\samsung-galaxy-s24-256gb-5g.csv,positive
samsung-galaxy-s24-256gb-5g,nhiều người thích s24 ultra nhưng mình thấy s24 bản nhỏ rất chân ái với những người tay nhỏ như mình từ iphone chuyển sang thấy rất hài lòng,5,ratings\samsung-galaxy-s24-256gb-5g.csv,positive
samsung-galaxy-s24-256gb-5g,sản phẩm dùng ok,5,ratings\samsung-galaxy-s24-256gb-5g.csv,positive
samsung-galaxy-s24-ultra-5g,dùng đến thời điểm này thấy rất tốt mình thì không cài fb tiktok shope nên cảm giác cũng giúp máy mượt hơn máy có nhiều tính năng đa nhiệm tốt hỗ trợ cho công việc làm nghiên cứu của mình tranh thủ lúc trông con mua đúng đợt trước khi có 25 ra trước tết nên được giá ưu đãi 22tr5 ,5,ratings\samsung-galaxy-s24-ultra-5g.csv,positive
samsung-galaxy-s24-ultra-5g,còn gì bằng nữa một sản phẩm thiết kế đẹp chất lượng có bút stylus kèm theo viết tin nhắn ghi chú rất tiện lợi cấu hình cao độ phân giải 2k màn hình sắc nét lúc mình mua con này có khuyến mãi giảm giá nên rất thích mình thích màu xám và màu vàng thiết kế của máy này rất đẹp mọi người ơi nên mua nhé,5,ratings\samsung-galaxy-s24-ultra-5g.csv,positive
samsung-galaxy-s24-ultra-5g,máy hay bị đơ lỗi không vuốt được dùng cứ lúc là lại bị đơ không thao tác được gì,5,ratings\samsung-galaxy-s24-ultra-5g.csv,positive
samsung-galaxy-s24-ultra-5g,cửa hàng mình có miếng dán cường lực nào tốt sử dụng được vân tay ko24 này kén miếng dán quá dán nhiều loại mà không có loại nào ưng ý,5,ratings\samsung-galaxy-s24-ultra-5g.csv,positive
samsung-galaxy-s24-ultra-5g,hỏm mua 29tr9 xong qua hôm còn 25tr chán thiệt,1,ratings\samsung-galaxy-s24-ultra-5g.csv,negative
samsung-galaxy-s24-ultra-5g,cho hỏi tgđ có dán màn hình mà vẫn đảm bảo quét vân tay không ạ,5,ratings\samsung-galaxy-s24-ultra-5g.csv,positive
samsung-galaxy-s24-ultra-5g,chất lượng tốt pin trâu máy mượt hiệu năng ok,5,ratings\samsung-galaxy-s24-ultra-5g.csv,positive
samsung-galaxy-s24-ultra-5g,dùng máy cũng gần được năm cá nhân dùng cảm thấy mượt màn hình đẹp camera tốt pin cũng ổn hiệu năng tốt,5,ratings\samsung-galaxy-s24-ultra-5g.csv,positive
samsung-galaxy-s24-ultra-5g,trải nghiệm thật sự rất tệ máy có bụi trong camera sau mang máy qua thì làm khó dễ không cho đổi máy đến khi phản ánh thì trả giá nhiều lần cuối cùng cho đổi máy đến khi mang máy qua đổi thì nhân viên thái độ khó chịu với khách hàng đổi máy mới vẫn bị bụi trong camera sau là do hãng hay do cửa hàng bán máy lỗi cho khách,1,ratings\samsung-galaxy-s24-ultra-5g.csv,negative
samsung-galaxy-s24-ultra-5g,kỹ thuật viên không có trình độ không biết cách test sản phẩm tệ pin thì tụt như chạy hội vẫn báo bình thường nên né thế giới di động,1,ratings\samsung-galaxy-s24-ultra-5g.csv,negative
samsung-galaxy-s24-ultra-5g,điện thoại mua được ngày sáng sạc đầy pin dùng đến chiều muộn cắm sạc thì không nhận sạc thử nhiều lần cũng không được đã mang ra thế giới di động kiểm tra sạc cũng không được đêm mình tắt nguồn xong cắm sạc lại được đến sáng cắm lại không được giờ cắm sạc lại được như này có đổi được không ạ,5,ratings\samsung-galaxy-s24-ultra-5g.csv,positive
samsung-galaxy-s24-ultra-5g,vừa mua chưa được tháng giảm củ,5,ratings\samsung-galaxy-s24-ultra-5g.csv,positive
samsung-galaxy-s24-ultra-5g,bỏ ra 28tr mua cái điện thoại vân tay không nhạy máy thì lag đem ra điện máy xanh vĩnh tân tân uyên bình dương nhân viên kỹ thuật yếu kém không biết gì máy nga đang dùng 120h mà thần kỹ thuật chỉnh lại 60h nói nó ngu mà nó còn cải nói chuyện với khách hàng lấc cấc lấc cát bố đời không giải quyết được gì,1,ratings\samsung-galaxy-s24-ultra-5g.csv,negative
samsung-galaxy-s24-ultra-5g,có ai dùng s24 lúc dùng bị nóng máy từ lúc mua về tới giờ chỉ dùng zalo với ticto dùng s24 lúc dùng bị nóng máy từ lúc mua về tới giờ chỉ dùng zalo với tic tock mà vẩn nóng ốp phía sau bị bong ra không nhỉ,1,ratings\samsung-galaxy-s24-ultra-5g.csv,negative
